{"detectedRuntime":"Python 3","environment":"LOCAL","formatChecker":true,"interpreterSha256":"b8d8288faefdd300201f43fcf00f6f539a27218eeed3a3dff5ab10b9c4c99700","jsonschemaVersion":"4.19.2","observedAt":"2026-07-16T09:48:08Z","runtimeCommand":"python3","targetRuntime":"Python 3","validator":"Draft202012Validator","version":"3.14.4 (main, Jun 18 2026, 14:25:02) [GCC 15.2.0]"}
